{"trace_id":"fixture-en","source_record_id":"fixture","pipeline_id":"test-bm25","language":"en","query":"How can I change my card password?","reference_answer":"Change the password in the application.","gold_evidence":[{"document_id":"doc-1","gold_text":"change card password","covering_chunk_ids":["chunk-1"],"is_preserved":true}],"source_documents":[{"document_id":"doc-1","text":"Customers can change a card password in the application."}],"chunks":[{"chunk_id":"chunk-1","document_id":"doc-1","text":"Customers can change a card password in the application.","start_char":0,"end_char":56}],"retrieval":{"method":"bm25","top_k":5,"retrieved_chunks":[{"chunk_id":"chunk-1","document_id":"doc-1","rank":1,"score":1.0,"text":"Customers can change a card password in the application."}]},"context_construction":{"selected_chunk_ids":["chunk-1"],"dropped_chunk_ids":[],"deduplicated_chunk_ids":[],"context_token_count":10,"truncated":false,"final_context":"Customers can change a card password in the application."},"generation":{"final_answer":"You can change your card password in the application.","model_name":"fixture","temperature":0,"prompt_version":"test","status":"success","error":null},"runtime":{"status":"success"}}
